Key,Shared Comments,English(en),English(en) Comments,Korean(ko),Korean(ko) Comments
"GGemCo_NPC_Message_101","","This is store one. How can I help you?","","여기는 상점 1입니다. 무엇을 도와드릴까요?",""
"GGemCo_NPC_Message_102","","Please post items to strengthen.","","강화할 아이템을 올려주세요.",""
"GGemCo_NPC_Message_103","","This is store 2. How can I help you?","","여기는 상점 2입니다. 무엇을 도와드릴까요?",""
"GGemCo_NPC_Message_104","","Please upload the items that you want to disassemble.","","분해할 아이템을 올려주세요.",""
"GGemCo_NPC_Message_105","","Please post items to strengthen.","","강화할 아이템을 올려주세요.",""
"GGemCo_NPC_Message_106","","Please post the items you will leave with.","","보관할 아이템을 올려주세요.",""
"GGemCo_NPC_Message_107","","What items will you make?","","어떤 아이템을 제작하시겠습니까?",""
"GGemCo_NPC_Message_108","","What items will you make?","","어떤 포션을 제작하시겠습니까?",""
"GGemCo_NPC_Message_109","","Go to Sleep for the night?","","오늘은 이만 잠들까요?",""